user_input,user_intent,score
"Third-party motor inspection","Motor self inspection",1.0
"Challan payment plans","View Challans",1.0
"Driving license hologram verification","Driving Licence",1.0
"PUC validity for vintage cars","PUC Validity",1.0
"DriveSmart fuel efficiency tips","IL DriveSmart",1.0
"Motor inspection for insurance","Motor self inspection",1.0
"Challan due date reminders","View Challans",1.0
"Driving license renewal steps","Driving Licence",1.0
"PUC validity and pollution norms","PUC Validity",1.0
"DriveSmart night driving analytics","IL DriveSmart",1.0
"Motor inspection certification process","Motor self inspection",1.0
"Check challans across states","View Challans",1.0
"Driving license biometric update","Driving Licence",1.0
"PUC validity for imported bikes","PUC Validity",1.0
"DriveSmart carpooling rewards","IL DriveSmart",1.0
"Motor inspection for commercial trucks","Motor self inspection",1.0
"Challan payment history archive","View Challans",1.0
"Driving license test reschedule","Driving Licence",1.0
"PUC validity during lockdown","PUC Validity",1.0
"DriveSmart eco-driving score","IL DriveSmart",1.0
"Motor inspection app troubleshooting","Motor self inspection",1.0
"View challans with vehicle number","View Challans",1.0
"Driving license smart card delivery","Driving Licence",1.0
"PUC validity for hybrid cars","PUC Validity",1.0
"DriveSmart trip history export","IL DriveSmart",1.0
"Motor inspection for vintage vehicles","Motor self inspection",1.0
"Challan payment via UPI","View Challans",1.0
"Driving license address change steps","Driving Licence",1.0
"PUC validity and insurance renewal","PUC Validity",1.0
"PUC validity and insurance renewal","Motor self inspection",0.4
"DriveSmart speed limit alerts","IL DriveSmart",1.0
"Motor inspection for leased cars","Motor self inspection",1.0
"Check challan with DL number","View Challans",0.8
"Check challan with DL number","Driving Licence",0.6
"Renew PUC and driving license together","PUC Validity",1.0
"Renew PUC and driving license together","Driving Licence",0.9
"DriveSmart and motor inspection linked","IL DriveSmart",1.0
"DriveSmart and motor inspection linked","Motor self inspection",0.7
"Challan disputes via DriveSmart app","View Challans",1.0
"Challan disputes via DriveSmart app","IL DriveSmart",0.6
"Update PUC and license simultaneously","PUC Validity",1.0
"Update PUC and license simultaneously","Driving Licence",0.7
"Motor inspection affects DriveSmart score","Motor self inspection",1.0
"Motor inspection affects DriveSmart score","IL DriveSmart",0.8
"Pay challan and check PUC validity","View Challans",1.0
"Pay challan and check PUC validity","PUC Validity",0.7
"Driving license renewal with PUC","Driving Licence",1.0
"Driving license renewal with PUC","PUC Validity",0.5
"DriveSmart rewards for clean PUC","IL DriveSmart",1.0
"DriveSmart rewards for clean PUC","PUC Validity",0.6
"Self-inspection before DriveSmart audit","Motor self inspection",1.0
"Self-inspection before DriveSmart audit","IL DriveSmart",0.4
"Challan history impacts DriveSmart rating","View Challans",1.0
"Challan history impacts DriveSmart rating","IL DriveSmart",0.7
"Expired PUC blocks license renewal","PUC Validity",1.0
"Expired PUC blocks license renewal","Driving Licence",0.6
"Motor inspection checklist in DriveSmart","Motor self inspection",1.0
"Motor inspection checklist in DriveSmart","IL DriveSmart",0.5
"Challan payment via DriveSmart wallet","View Challans",1.0
"Challan payment via DriveSmart wallet","IL DriveSmart",0.8
"Upload PUC after self-inspection","PUC Validity",1.0
"Upload PUC after self-inspection","Motor self inspection",0.7
"DriveSmart tips to avoid challans","IL DriveSmart",1.0
"DriveSmart tips to avoid challans","View Challans",0.6
"Renew license without valid PUC","Driving Licence",1.0
"Initiate health coverage policy","Add Health Policy",1